hash,author,date,title,faultID,file
dbe50f0,argriffing,2015-05-26 16:33:39,Merge pull request #4912 from rgommers/fix-typo,4911
44b596e,Ralf Gommers,2015-05-26 22:30:02,MAINT: fix typo in stats tutorial.  Closes gh-4911.,4911
56cf073,Abraham Escalante,2015-05-24 14:40:56,MAINT: prepend underscore to mask_to_limits; delete masked_var.,585,scipy/stats/stats.py
7175e14,Maniteja Nandana,2015-05-10 23:01:07,DOC:Fix error in ode docstring example Fix print formatting error in ode docstring example. fixes #4772,4772,scipy/integrate/_ode.py
cf1f43f,Warren Weckesser,2015-05-09 12:22:41,BUG: signal: Make spectrogram's return values order match the docs and test.,4844,scipy/signal/spectral.py
7509169,Ralf Gommers,2015-05-09 15:07:25,TST: fix test failures in scipy.special with mingw32 due to test precision.,4840,scipy/special/tests/test_basic.py
7509169,Ralf Gommers,2015-05-09 15:07:25,TST: fix test failures in scipy.special with mingw32 due to test precision.,4840,scipy/special/tests/test_data.py
21483e7,Eric Moore,2015-05-05 08:52:48,BUG: Relaxed strides cleanup in decomp_update.pyx.in,4736,scipy/linalg/tests/test_decomp_update.py
6115c09,CJ Carey,2015-05-01 16:04:19,BUG: numpoints wasn't incremented for new points,4791
406e88a,CJ Carey,2015-05-01 14:39:56,TST: adding test case for #4791,4791,scipy/spatial/tests/test_qhull.py
e83e981,Thomas Robitaille,2015-04-10 17:27:24,BUG: io.idl: don’t crash if a pointer reference is not found in the heap.,4613,scipy/io/idl.py
67dce17,Denis Laxalde,2015-04-25 13:28:27,Merge pull request #4769 from Andreea-G/cobyla_rhoend,4726
5b802a1,Andreea_G,2015-04-24 18:40:13,Fixes #4726: test_cobyla.test_vector_constraints Set rhoend and tol as 1e-5 in test_cobyla for fmin_cobyla and minimize.,4726,scipy/optimize/tests/test_cobyla.py
bca1d9c,argriffing,2015-04-23 21:30:52,Merge pull request #4762 from Andreea-G/linprog_artificial,4746
4b9f1d4,Evgeni Burovski,2015-04-16 23:50:32,"DOC: special: TeX typesetting of rel_entr, kl_div and pseudo_huber",4732,scipy/special/add_newdocs.py
a7ded12,ldamewood,2015-04-13 11:46:51,MAINT: Fix gengamma _nump failure at large values of `a`,4724,scipy/stats/_continuous_distns.py
a7ded12,ldamewood,2015-04-13 11:46:51,MAINT: Fix gengamma _nump failure at large values of `a`,4724,scipy/stats/tests/test_distributions.py
643cd58,Eric Moore,2015-04-06 16:29:24,BUG: fix broadcasting in lfilter with some singleton dims.,4681,scipy/signal/tests/test_signaltools.py
ce9c441,Abraham Escalante,2015-04-05 00:23:56,ENH: added functionality to handle scalars in `stats._chk_asarray`,4550,scipy/stats/stats.py
ce9c441,Abraham Escalante,2015-04-05 00:23:56,ENH: added functionality to handle scalars in `stats._chk_asarray`,4550,scipy/stats/tests/test_stats.py
1dbecec,Clancy Rowley,2015-03-29 17:35:17,Rework lsim; fixes #2652 and #1104,2652,scipy/signal/ltisys.py
d3431cd,Clancy Rowley,2015-03-29 17:17:26,Add tests showing problems with lsim,2652,scipy/signal/tests/test_ltisys.py
8a6e358,Abraham Escalante,2015-03-21 18:36:05,DEP: deprecate scipy.stats.signaltonoise,609,scipy/stats/stats.py
8a6e358,Abraham Escalante,2015-03-21 18:36:05,DEP: deprecate scipy.stats.signaltonoise,609,scipy/stats/tests/test_stats.py
7f5f2f3,Maniteja Nandana,2015-03-21 00:54:07,"DOC: Fix the error in convolve for same mode In the tutorial for same mode, it was incorrectly mentioned that the convolve output has the same length as the largest input instead of the first input. fixes #4640",4640
dd18ccc,Maniteja Nandana,2015-03-14 17:56:50,MAINT: Fix convergence message for remez,4569
83741a0,Evgeni Burovski,2015-03-14 10:22:50,Merge pull request #4620 from gmcastil/fix-arpack-eigen,4590
c3baa71,Ralf Gommers,2015-03-14 11:11:05,Merge pull request #4619 from aeklant/issue_#4550,4550
8624f69,Evgeni Burovski,2015-03-13 22:27:27,Merge pull request #4629 from woodscn/fix_nquad_bug,4599
0424edc,George Castillo,2015-03-10 19:25:38,BUG: Fix issue (#4590) with svds not checking for invalid eigenvalue parameter,4590,scipy/sparse/linalg/eigen/arpack/arpack.py
0424edc,George Castillo,2015-03-10 19:25:38,BUG: Fix issue (#4590) with svds not checking for invalid eigenvalue parameter,4590,scipy/sparse/linalg/eigen/arpack/tests/test_arpack.py
2157c66,Abraham Escalante,2015-03-10 18:38:15,ENH: add capability for stats.mode to handle empty arrays as parameters.,4550,scipy/stats/stats.py
2157c66,Abraham Escalante,2015-03-10 18:38:15,ENH: add capability for stats.mode to handle empty arrays as parameters.,4550,scipy/stats/tests/test_stats.py
a083d15,Matěj Kocián,2015-03-10 23:41:41,FIX: Raise error when window length != data length,3603,scipy/signal/signaltools.py
6d07cd0,Eric Moore,2015-03-10 10:57:52,"BUG: lfilter, the size of zi was not checked correctly or nd in.",4612,scipy/signal/tests/test_signaltools.py
bfbc352,CJ Carey,2015-03-02 17:40:59,DOC: optimize: remove references to disp kwarg,4582,scipy/optimize/optimize.py
d4e9201,Jonas Hahnfeld,2015-03-02 13:41:59,uses_mkl: Fix broken check when linking against libmkl_rt.so,4521,scipy/_build_utils/_fortran.py
ec15a93,Jonas Hahnfeld,2015-03-02 13:34:33,g77_abi_wrapper: Enable wrapper for Intel MKL on Linux,4520,scipy/_build_utils/_fortran.py
5a73d31,Ralf Gommers,2015-02-15 04:37:19,ENH: rewrite of stats.ppcc_plot.  Closes gh-679.,679,scipy/stats/morestats.py
97f34c5,Ralf Gommers,2015-02-26 17:08:38,DEP: deprecate stats.fastsort.  Closes gh-667.,667,scipy/stats/stats.py
3b6afc3,Rupak,2015-01-15 10:47:54,ENH: stats: increase accuracy of gompertz distribution for small x.,4031,scipy/stats/_continuous_distns.py
3b6afc3,Rupak,2015-01-15 10:47:54,ENH: stats: increase accuracy of gompertz distribution for small x.,4031,scipy/stats/tests/test_distributions.py
ea703b7,maniteja123,2015-01-23 03:16:21,"ENH: Improve rayleigh accuracy for large x.closes #4034 Included tests for rayleigh, lomax and truncexpon distributions",4034,scipy/stats/tests/test_distributions.py
76f257e,Pauli Virtanen,2015-01-20 10:46:30,DOC: optimize: fix wrong result in docstring,4438,scipy/optimize/_linprog.py
c88c142,maniteja123,2015-01-18 07:25:08,ENH: Updated tests for lomax and rayleigh accuracy Take care of floating point comparison in tests.closes #4034,4034,scipy/stats/_continuous_distns.py
c88c142,maniteja123,2015-01-18 07:25:08,ENH: Updated tests for lomax and rayleigh accuracy Take care of floating point comparison in tests.closes #4034,4034,scipy/stats/tests/test_distributions.py
bcb7c3a,Ralf Gommers,2015-01-18 17:38:31,BLD: fix build failure with numpy 1.7.x and 1.8.x.,4417
515fa79,maniteja123,2015-01-18 05:08:01,ENH: Improve accuracy of truncexpon for small x. closes #4035,4035,scipy/stats/_continuous_distns.py
515fa79,maniteja123,2015-01-18 05:08:01,ENH: Improve accuracy of truncexpon for small x. closes #4035,4035,scipy/stats/tests/test_distributions.py
5bae3f1,argriffing,2015-01-17 17:54:07,Merge pull request #4416 from rgommers/splilu-doc-issue-4393,4393
e2e3f0a,Ralf Gommers,2015-01-17 10:22:16,DOC: correct a parameter name in docstring of SuperLU.solve.  Closes gh-4393.,4393,scipy/sparse/linalg/dsolve/_add_newdocs.py
3622154,maniteja123,2015-01-16 14:11:17,ENH: Improve accuracy of lomax. Closes #4033,4033,scipy/stats/_continuous_distns.py
3622154,maniteja123,2015-01-16 14:11:17,ENH: Improve accuracy of lomax. Closes #4033,4033,scipy/stats/tests/test_distributions.py
45bd13d,Maniteja Nandana,2015-01-16 23:53:23,DOC:scipy.signal.cwt documentation.closes #4412,4412,scipy/signal/wavelets.py
fa5f390,Eric Moore,2015-01-16 09:01:35,"BUG: Tests too strict, f2py doesn't have to overwrite this array",4410,scipy/linalg/tests/test_blas.py
4a38353,Andreas Mayer,2015-01-13 15:45:13,BUG: fix argcheck of stat.hypergeom,2325,scipy/stats/_discrete_distns.py
51ef0bf,Andreas Mayer,2015-01-13 14:51:54,TST: add tests of stat.hypergeom for corner cases (Issue #2325),2325,scipy/stats/tests/test_distributions.py
84ddf80,Denis Laxalde,2015-01-10 13:47:19,Merge pull request #4385 from andyfaff/nit,3855
a13e116,Ralf Gommers,2015-01-01 15:28:02,MAINT: remove optimize.anneal for 0.16.0 (was deprecated in 0.14.0).,1653,scipy/optimize/__init__.py
a13e116,Ralf Gommers,2015-01-01 15:28:02,MAINT: remove optimize.anneal for 0.16.0 (was deprecated in 0.14.0).,1653,scipy/optimize/_minimize.py
a13e116,Ralf Gommers,2015-01-01 15:28:02,MAINT: remove optimize.anneal for 0.16.0 (was deprecated in 0.14.0).,1653,scipy/optimize/anneal.py
a13e116,Ralf Gommers,2015-01-01 15:28:02,MAINT: remove optimize.anneal for 0.16.0 (was deprecated in 0.14.0).,1653,scipy/optimize/optimize.py
a13e116,Ralf Gommers,2015-01-01 15:28:02,MAINT: remove optimize.anneal for 0.16.0 (was deprecated in 0.14.0).,1653,scipy/optimize/tests/test__basinhopping.py
a13e116,Ralf Gommers,2015-01-01 15:28:02,MAINT: remove optimize.anneal for 0.16.0 (was deprecated in 0.14.0).,1653,scipy/optimize/tests/test_anneal.py
a13e116,Ralf Gommers,2015-01-01 15:28:02,MAINT: remove optimize.anneal for 0.16.0 (was deprecated in 0.14.0).,1653,scipy/optimize/tests/test_optimize.py
a13e116,Ralf Gommers,2015-01-01 15:28:02,MAINT: remove optimize.anneal for 0.16.0 (was deprecated in 0.14.0).,1653,scipy/optimize/zeros.py
7b8a4c2,Eric Moore,2014-05-23 16:02:38,BUG: fix sporadic slepian failures,3675,scipy/signal/windows.py
4cc2be7,bewithaman,2014-12-29 16:36:34,MAINT: Implement stats.betaprime.cdf,4030,scipy/stats/_continuous_distns.py
4cc2be7,bewithaman,2014-12-29 16:36:34,MAINT: Implement stats.betaprime.cdf,4030,scipy/stats/tests/test_distributions.py
e4e9284,argriffing,2014-12-26 14:28:44,Merge pull request #4310 from bewithaman/master,4028
c18beb4,Aman Singh,2014-12-24 16:59:27,BUG#4028,4028,scipy/stats/_discrete_distns.py
aed6d2f,Aman Singh,2014-12-24 16:29:28,BUG#4028,4028,scipy/stats/_discrete_distns.py
69568c4,bewithaman,2014-12-24 15:28:22,'BUG:4028',4028,scipy/stats/_discrete_distns.py
69568c4,bewithaman,2014-12-24 15:28:22,'BUG:4028',4028,scipy/stats/tests/test_distributions.py
f564c70,Gregory R. Lee,2014-10-09 16:36:34,"TST: add test for special.diric, including values near 2*pi (see gh-4001)",4001,scipy/special/basic.py
f564c70,Gregory R. Lee,2014-10-09 16:36:34,"TST: add test for special.diric, including values near 2*pi (see gh-4001)",4001,scipy/special/tests/test_basic.py
2077254,argriffing,2014-12-18 17:32:33,Merge pull request #4287 from rgommers/deprecate-pdffromgamma,699
221cfa2,Ralf Gommers,2014-12-17 22:02:52,DEP: deprecate stats.pdf_fromgamma.  Closes gh-699.,699,scipy/stats/morestats.py
b5aeaf5,argriffing,2014-12-18 14:39:25,Merge pull request #3 from larsmans/hamming-unequal-length,4290
832147f,Lars Buitinck,2014-12-18 20:31:05,TST: spatial: regression test for gh-4290,4290,scipy/spatial/tests/test_distance.py
17d2d34,Warren Weckesser,2014-12-16 01:09:43,BUG: integrate: odeint crashed when the integration time was 0.,4282,scipy/integrate/odepack.py
17d2d34,Warren Weckesser,2014-12-16 01:09:43,BUG: integrate: odeint crashed when the integration time was 0.,4282,scipy/integrate/tests/test_integrate.py
ec45ce6,Aldrian Obaja,2014-12-15 13:42:57,Add benchmark for large matrix multiplication,4203,scipy/sparse/benchmarks/bench_sparse.py
181db58,Ralf Gommers,2014-12-08 23:25:29,Merge pull request #4212 from matthew-brett/test-sparse-patch,4208
7018c11,Ralf Gommers,2014-12-08 00:31:53,BUG: optimize: fix issue with incorrect use of closure for slsqp.,4240,scipy/optimize/slsqp.py
7018c11,Ralf Gommers,2014-12-08 00:31:53,BUG: optimize: fix issue with incorrect use of closure for slsqp.,4240,scipy/optimize/tests/test_optimize.py
7a7f734,Matthew Brett,2014-11-29 23:33:22,BUG: make matlab happy with empty sparse arrays,4208,scipy/io/matlab/mio5.py
0a95823,Matthew Brett,2014-11-30 08:38:16,ENH: specific warning if matlab file is empty,4081,scipy/io/matlab/miobase.py
0a95823,Matthew Brett,2014-11-30 08:38:16,ENH: specific warning if matlab file is empty,4081,scipy/io/matlab/tests/test_mio.py
2ba92c8,Julian Taylor,2014-11-13 15:11:56,BUG: fix ndimage functions for large data,3733,scipy/ndimage/tests/test_ndimage.py
c20b2bd,Chris Kerr,2014-08-31 11:00:48,"Deprecate nanmean, nanstd, nanmedian in favour of the numpy equivalents",1727,scipy/stats/stats.py
4a042f4,Evgeni Burovski,2014-10-21 20:16:36,"BUG: fitpack: avoid a memory error in splev(x, tck, der=k)",2188,scipy/interpolate/tests/test_fitpack.py
b60daa6,Warren Weckesser,2014-10-07 18:34:34,MAINT: stats: Add note about change to scoreatpercentile in release 0.12.0.,3329,scipy/stats/tests/test_stats.py
30eb376,Warren Weckesser,2014-10-06 17:44:15,BUG: stats: Refactor argument validation to avoid a unicode issue.,4026,scipy/stats/_binned_statistic.py
30eb376,Warren Weckesser,2014-10-06 17:44:15,BUG: stats: Refactor argument validation to avoid a unicode issue.,4026,scipy/stats/tests/test_binned_statistic.py
c128dd9,Warren Weckesser,2014-09-30 15:44:15,BUG: misc: Ensure that the 'size' argument of PIL's 'resize' method is a tuple.,4032,scipy/misc/pilutil.py
49eccee,Warren Weckesser,2014-09-17 11:47:47,"BUG: stats: gengamma.pdf(0,1,1) now returns 1.0 instead of nan.",3985,scipy/stats/_continuous_distns.py
49eccee,Warren Weckesser,2014-09-17 11:47:47,"BUG: stats: gengamma.pdf(0,1,1) now returns 1.0 instead of nan.",3985,scipy/stats/tests/test_distributions.py
0a04cf7,Warren Weckesser,2014-09-17 11:35:22,BUG: stats: Better handling of x=0 in the 'exponpow' distribution.,3982,scipy/stats/_continuous_distns.py
0a04cf7,Warren Weckesser,2014-09-17 11:35:22,BUG: stats: Better handling of x=0 in the 'exponpow' distribution.,3982,scipy/stats/tests/test_distributions.py
6a5d0a1,Pauli Virtanen,2014-08-31 16:32:07,BUG: io.netcdf: do not close mmap if there are references left to it,3630,scipy/io/netcdf.py
6a5d0a1,Pauli Virtanen,2014-08-31 16:32:07,BUG: io.netcdf: do not close mmap if there are references left to it,3630,scipy/io/tests/test_netcdf.py
47e19eb,Bastian Venthur,2014-08-31 16:10:14,FIX: Raise value error if window data-type is unsupported,3603,scipy/signal/tests/test_windows.py
47e19eb,Bastian Venthur,2014-08-31 16:10:14,FIX: Raise value error if window data-type is unsupported,3603,scipy/signal/windows.py
b365f9b,Bastian Venthur,2014-08-31 15:53:06,FIX: Corrected error message of eigsh.,3714,scipy/sparse/linalg/eigen/arpack/arpack.py
6977bc2,Bastian Venthur,2014-08-31 11:46:27,Added a warning about leastsq using with NaNs.,3491,scipy/optimize/minpack.py
dca6e0b,Andreas Hilboll,2014-08-31 11:30:59,BUG: FITPACK conditions were not properly checked in LSQUnivariateSpline.,2611,scipy/interpolate/fitpack2.py
dca6e0b,Andreas Hilboll,2014-08-31 11:30:59,BUG: FITPACK conditions were not properly checked in LSQUnivariateSpline.,2611,scipy/interpolate/tests/test_fitpack2.py
abcac91,Joris Vankerschaver,2014-08-31 10:57:40,DOC: surround methods in class docstrings with backticks.,3915,scipy/stats/_distn_infrastructure.py
0860ded,Bastian Venthur,2014-08-31 10:50:54,Coerce args into tuple if necessary.,3503,scipy/optimize/_minimize.py
d6f85ca,Evgeni Burovski,2014-08-31 10:26:58,Merge pull request #3922 from venthur/fix-3905,3905
678149b,Bastian Venthur,2014-08-31 10:02:22,Fixed Docstring issues in linprog (Fixes #3905).,3905,scipy/optimize/_linprog.py
2c91339,Ralf Gommers,2014-08-28 15:48:42,TST: fix test errors in sparse tests that compare NaNs.  Closes gh-3901.,3901,scipy/sparse/tests/test_base.py
13a73f4,argriffing,2014-08-04 23:57:05,Merge pull request #3857 from pfctdayelise/master,3814
909d1fc,Brianna Laugher,2014-08-05 11:57:01,Fix for stats.mode to work on character arrays. Closes #3814,3814,scipy/stats/stats.py
909d1fc,Brianna Laugher,2014-08-05 11:57:01,Fix for stats.mode to work on character arrays. Closes #3814,3814,scipy/stats/tests/test_stats.py
02b93a8,Denis Laxalde,2014-07-31 11:54:19,Merge pull request #3845 from trendelkampschroer/master,3842
1dd2992,Zhenya,2014-01-24 14:00:25,BUG: use special.log1p instead of np.log1p,4225,scipy/stats/_continuous_distns.py
1dd2992,Zhenya,2014-01-24 14:00:25,BUG: use special.log1p instead of np.log1p,4225,scipy/stats/tests/test_continuous_basic.py
1dd2992,Zhenya,2014-01-24 14:00:25,BUG: use special.log1p instead of np.log1p,4225,scipy/stats/tests/test_distributions.py
150270f,Evgeni Burovski,2014-07-23 11:03:56,"MAINT: avoid spurious warnings in binom(n, p=0).mean() etc",3817,scipy/stats/_discrete_distns.py
150270f,Evgeni Burovski,2014-07-23 11:03:56,"MAINT: avoid spurious warnings in binom(n, p=0).mean() etc",3817,scipy/stats/tests/test_distributions.py
85ba6f5,Pauli Virtanen,2014-07-21 23:20:25,Merge pull request #3779 from ewmoore/incbet_fix,3761
3278bf7,Jacob Carey,2014-07-11 21:32:00,BUG: Fix lombscargle ZeroDivisionError,3787
db535b2,Jacob Carey,2014-07-10 18:57:37,ENH: Add ext parameter to UnivariateSpline,3557,scipy/interpolate/fitpack2.py
816638f,Pauli Virtanen,2014-07-10 12:50:46,BUG: sparse: fix omitted types in sparsetools typemaps,3780
200a030,Eric Moore,2014-07-09 14:52:14,"BUG: don't try to calculate beta in betainc, just call it.",3761,scipy/special/tests/test_basic.py
04e049d,Jacob Carey,2014-07-07 18:54:29,ENH: Add ext parameter to UnivariateSpline,3557,scipy/interpolate/fitpack2.py
04e049d,Jacob Carey,2014-07-07 18:54:29,ENH: Add ext parameter to UnivariateSpline,3557,scipy/interpolate/tests/test_fitpack2.py
d0536f2,Ralf Gommers,2014-07-06 21:18:44,"BUG: in integrate/quadpack.h, put all declarations before statements.",2362
6c254b5,Jacob Carey,2014-07-05 22:40:30,ENH: Add ext parameter to UnivariateSpline call,3557,scipy/interpolate/fitpack2.py
6c254b5,Jacob Carey,2014-07-05 22:40:30,ENH: Add ext parameter to UnivariateSpline call,3557,scipy/interpolate/tests/test_fitpack2.py
eccd8be,Eric Moore,2014-06-02 17:04:07,"BUG: special: ellip(k,e)inc nan and double expected value",3550,scipy/special/tests/test_basic.py
7e67f23,Pauli Virtanen,2014-06-14 19:55:50,Merge pull request #3647 from foogod/bugfix-3596,3596
1d62968,Andreas Hilboll,2014-06-04 09:23:59,BUG: handle fill_value dtype checks correctly in RegularGridInterpolator,3703,scipy/interpolate/interpolate.py
1d62968,Andreas Hilboll,2014-06-04 09:23:59,BUG: handle fill_value dtype checks correctly in RegularGridInterpolator,3703,scipy/interpolate/tests/test_interpolate.py
bae27f0,Andreas Hilboll,2014-06-01 22:40:38,BUG: cast 'x' to correct dtype in KroghInterpolator._evaluate,3669,scipy/interpolate/polyint.py
604a793,Andreas Hilboll,2014-06-01 22:21:53,ENH: check for valid 'orientation' kwarg in dendrogram(),3668,scipy/cluster/hierarchy.py
604a793,Andreas Hilboll,2014-06-01 22:21:53,ENH: check for valid 'orientation' kwarg in dendrogram(),3668,scipy/cluster/tests/test_hierarchy.py
0f67b1d,Andreas Hilboll,2014-06-01 21:54:22,Update continuous.rst,3587
589c372,CJ Carey,2014-05-13 15:06:38,BUG: sparse: smarter random index selection,3648,scipy/sparse/construct.py
589c372,CJ Carey,2014-05-13 15:06:38,BUG: sparse: smarter random index selection,3648,scipy/sparse/tests/test_construct.py
5fa60c9,Ralf Gommers,2014-05-27 01:34:30,DOC: add docstring to special.assoc_laguerre and add that to built docs.,2746,scipy/special/__init__.py
5fa60c9,Ralf Gommers,2014-05-27 01:34:30,DOC: add docstring to special.assoc_laguerre and add that to built docs.,2746,scipy/special/basic.py
7209146,Ralf Gommers,2014-05-26 22:50:42,DOC: add some docstrings for special functions in the ncfdtr family.,2746,scipy/special/__init__.py
7209146,Ralf Gommers,2014-05-26 22:50:42,DOC: add some docstrings for special functions in the ncfdtr family.,2746,scipy/special/add_newdocs.py
e97ae71,Ralf Gommers,2014-05-26 22:05:08,DOC: add some docstrings for special functions in the nctdtr family.,2746,scipy/special/__init__.py
e97ae71,Ralf Gommers,2014-05-26 22:05:08,DOC: add some docstrings for special functions in the nctdtr family.,2746,scipy/special/add_newdocs.py
e97ae71,Ralf Gommers,2014-05-26 22:05:08,DOC: add some docstrings for special functions in the nctdtr family.,2746,scipy/special/basic.py
c8648f1,Pauli Virtanen,2014-05-20 20:40:46,BUG: interpolate/fitpack: arguments to fortran routines may not be aliased,2911
bdaec40,Eric Moore,2014-05-16 15:14:33,BUG: signal.welch: ensure floating point dtype regardless of input dtype,3655,scipy/signal/spectral.py
bdaec40,Eric Moore,2014-05-16 15:14:33,BUG: signal.welch: ensure floating point dtype regardless of input dtype,3655,scipy/signal/tests/test_spectral.py
972481f,Alex Stewart,2014-05-12 18:25:53,Fix for #3596: Make fftconvolve threadsafe,3596,scipy/signal/signaltools.py
b20db6c,Richard Tsai,2014-03-28 10:43:37,BUG: cluster.vq.whiten returns nan or inf when std==0,3499,scipy/cluster/tests/test_vq.py
b20db6c,Richard Tsai,2014-03-28 10:43:37,BUG: cluster.vq.whiten returns nan or inf when std==0,3499,scipy/cluster/vq.py
15fbaa8,Pauli Virtanen,2014-04-27 23:31:23,Merge pull request #3484 from rgommers/mingw64-qhull,3237
3c4255e,Lars Buitinck,2014-04-27 19:06:31,BUG: sparse: fix operator overloading with custom types,3580,scipy/sparse/compressed.py
3c4255e,Lars Buitinck,2014-04-27 19:06:31,BUG: sparse: fix operator overloading with custom types,3580,scipy/sparse/data.py
3c4255e,Lars Buitinck,2014-04-27 19:06:31,BUG: sparse: fix operator overloading with custom types,3580,scipy/sparse/dok.py
3c4255e,Lars Buitinck,2014-04-27 19:06:31,BUG: sparse: fix operator overloading with custom types,3580,scipy/sparse/lil.py
3c4255e,Lars Buitinck,2014-04-27 19:06:31,BUG: sparse: fix operator overloading with custom types,3580,scipy/sparse/tests/test_base.py
c656841,Charles Harris,2014-04-22 14:50:48,Merge pull request #3564 from rgommers/numpy-deps,3554
7cd8e3e,Ralf Gommers,2014-04-19 20:47:07,TST: reduce test tolerance for LSMR test by 1 decimal.  See gh-3554.,3554,scipy/sparse/linalg/isolve/tests/test_lsmr.py
469a61b,Ralf Gommers,2014-04-19 19:07:02,TST: fix a test failure in stats.mstats reported in gh-3554.,3554,scipy/stats/tests/test_mstats_basic.py
fe01bc4,Warren Weckesser,2014-03-30 12:23:03,MAINT: stats: Reimplement the pdf and logpdf methods of exponweib.,3508,scipy/stats/_continuous_distns.py
fe01bc4,Warren Weckesser,2014-03-30 12:23:03,MAINT: stats: Reimplement the pdf and logpdf methods of exponweib.,3508,scipy/stats/tests/test_distributions.py
b35fc62,Thomas A Caswell,2014-04-13 16:12:43,TST : make tests use non-interactive matplotlib backend,3544,scipy/cluster/tests/test_hierarchy.py
2b0ade8,André Gaul,2014-03-27 14:56:07,[BUG] fix scipy.linalg.hessenberg,3364,scipy/linalg/decomp.py
19d9b69,Ralf Gommers,2014-03-23 23:07:02,BLD: fix Qhull build issue with MinGW-w64.  Closes gh-3237.,3237
890df9a,CJ Carey,2014-03-20 19:25:21,DOC: fix docstring for gh-3469,3469,scipy/ndimage/measurements.py
01e88d8,Ankit Agrawal,2014-02-28 05:49:03,BUG: make stats.f_oneway work with integer array input.,3376,scipy/stats/stats.py
01e88d8,Ankit Agrawal,2014-02-28 05:49:03,BUG: make stats.f_oneway work with integer array input.,3376,scipy/stats/tests/test_stats.py
b54a499,Ralf Gommers,2014-03-09 18:16:41,Merge branch 'pr/3394' into master.  Closes gh-2177.,2177
3ece75e,jamestwebber,2014-02-26 10:21:26,BUG: modified ClusterNode.pre_order() for non-root nodes.,2177,scipy/cluster/hierarchy.py
3879d21,Ralf Gommers,2014-02-28 08:11:58,Merge pull request #3414 from WarrenWeckesser/signal-test-tols,3412
95b63d1,Warren Weckesser,2014-02-27 17:59:03,TST: signal: loosen some error tolerances in the filter tests.  Closes gh-3412.,3412,scipy/signal/tests/test_filter_design.py
48d994f,Ralf Gommers,2014-02-25 21:58:47,"TST: fix sparse test errors due to axis=-1,-2 usage in np.matrix.sum().",3330,scipy/sparse/tests/test_base.py
2703450,Andreas Hilboll,2014-02-08 18:41:03,MAINT: use implementation from scipy.stats in scipy.stats.mstats for gmean and hmean,3196,scipy/stats/mstats.py
2703450,Andreas Hilboll,2014-02-08 18:41:03,MAINT: use implementation from scipy.stats in scipy.stats.mstats for gmean and hmean,3196,scipy/stats/mstats_basic.py
2703450,Andreas Hilboll,2014-02-08 18:41:03,MAINT: use implementation from scipy.stats in scipy.stats.mstats for gmean and hmean,3196,scipy/stats/tests/test_mstats_basic.py
541dcc4,Andreas Hilboll,2014-02-19 19:43:24,TST: test if fix for #2152 works,2152,scipy/io/tests/test_mmio.py
9a5820b,Andreas Hilboll,2014-02-18 22:21:49,BUG: add proper error handling when using interp2d on regular grids,1889,scipy/interpolate/interpolate.py
e634d59,Andreas Hilboll,2014-02-12 13:00:32,BUG: fix scipy.io.mmread() of gzipped and bzip2ed files under Python3,2152,scipy/io/mmio.py
312ddb9,Andreas Hilboll,2014-02-18 21:27:53,BUG: fix use of np.max in stats.fisher_exact,3014,scipy/stats/stats.py
312ddb9,Andreas Hilboll,2014-02-18 21:27:53,BUG: fix use of np.max in stats.fisher_exact,3014,scipy/stats/tests/test_stats.py
869bce9,Pauli Virtanen,2014-02-18 22:00:07,BUG: sparse: restore previous behavior in numpy ufuncs with object arrays,3345,scipy/sparse/base.py
869bce9,Pauli Virtanen,2014-02-18 22:00:07,BUG: sparse: restore previous behavior in numpy ufuncs with object arrays,3345,scipy/sparse/tests/test_base.py
937c197,Ralf Gommers,2014-02-04 09:45:52,"BUG: put back dbhash import in weave/catalog.py, while unused it had a purpose",3182,scipy/weave/catalog.py
0370917,Ralf Gommers,2014-01-01 22:11:20,TST: weave tests: add context manager to create/clean tempdirs for blitz().,2092,scipy/weave/inline_tools.py
0370917,Ralf Gommers,2014-01-01 22:11:20,TST: weave tests: add context manager to create/clean tempdirs for blitz().,2092,scipy/weave/tests/test_blitz_tools.py
0370917,Ralf Gommers,2014-01-01 22:11:20,TST: weave tests: add context manager to create/clean tempdirs for blitz().,2092,scipy/weave/tests/weave_test_utils.py
f7b417a,Andreas Hilboll,2014-02-12 09:38:11,BUG: fix behavior of write_values() with empty string in scipy.io.netcdf,1592,scipy/io/netcdf.py
ee1bb34,Pauli Virtanen,2014-02-09 14:54:36,BUG: optimize: fix refcount errors in tnc,3299
a5d38fc,Ralf Gommers,2013-12-30 10:35:04,DEP: remove deprecated umfpack wrapper.  Closes gh-3002.,3002,scipy/sparse/linalg/dsolve/linsolve.py
a5d38fc,Ralf Gommers,2013-12-30 10:35:04,DEP: remove deprecated umfpack wrapper.  Closes gh-3002.,3002,scipy/sparse/linalg/dsolve/setup.py
